{
  "schema_version": 1,
  "projection_id": "TOOL-PROJECTION-DEMO-001",
  "goal_id": "GOAL-DEMO-001",
  "tool_call_id": "TOOL-CALL-DEMO-001",
  "tool_result_receipt_id": "RCP-TOOL-DEMO-001",
  "classification": "BULK_EVIDENCE",
  "evidence_liveness": "LIVE",
  "source_bytes": 2800,
  "estimated_source_tokens": 700,
  "strategy": "INLINE_FULL",
  "candidate_strategy": "INLINE_BOUNDED_WITH_CAS",
  "application_status": "CAPTURE_ONLY",
  "projected_tokens": 700,
  "avoided_tokens": 0,
  "artifact_id": "ART-TOOL-DEMO-001",
  "artifact_sha256": "aaaaaaaaaaaaaaaaaaaaaaaaaaaaaaaaaaaaaaaaaaaaaaaaaaaaaaaaaaaaaaaa",
  "retained_evidence_ids": ["EVIDENCE-DEMO-001"],
  "rehydration_policy": "NOT_NEEDED",
  "readback_verified": true,
  "contains_secret": false,
  "quality_gate": "PASS",
  "recorded_at": "2026-07-22T08:00:01Z"
}
